id,title,assignee,inventor/author,priority date,filing/creation date,publication date,grant date,result link,representative figure link
EP-1104110-B1,Phase-combining circuit and timing signal generator circuit for carrying out a high-speed signal transmission ,Fujitsu Limited,"Hirotaka Tamura, Masaya Kibune",1999-11-26,2000-11-24,2011-09-21,2011-09-21,https://patents.google.com/patent/EP1104110B1/en,https://patentimages.storage.googleapis.com/47/fb/3a/4a3fb6943928d4/imgf0001.png
US-2244369-A,Electrical measuring and calculating device ,Rca Corp,Martin Louis,1938-10-31,1938-10-31,1941-06-03,1941-06-03,https://patents.google.com/patent/US2244369A/en,https://patentimages.storage.googleapis.com/87/79/6f/48d0c3d130d55f/US2244369-drawings-page-1.png
US-2794965-A,Statistical interpretation of seismograms ,Socony Mobil Oil Co Inc,William J Yost,1953-05-25,1953-05-25,1957-06-04,1957-06-04,https://patents.google.com/patent/US2794965A/en,https://patentimages.storage.googleapis.com/2a/db/08/2e4a797d0bde87/US2794965-drawings-page-1.png
JP-4798154-B2,Control apparatus for a hybrid vehicle ,日産自動車株式会社,佳代 音川,2008-03-06,2008-03-06,2011-10-19,2011-10-19,https://patents.google.com/patent/JP4798154B2/en,https://patentimages.storage.googleapis.com/09/85/bb/c361ada2d36bc7/0004798154-2.png
US-2679636-A,Method of and apparatus for comparing information ,Hillyer Curtis,Hillyer Curtis,1952-03-25,1952-03-25,1954-05-25,1954-05-25,https://patents.google.com/patent/US2679636A/en,https://patentimages.storage.googleapis.com/07/45/b7/f4bef4b558e4a5/US2679636-drawings-page-1.png
US-6941336-B1,Programmable analog system architecture ,Cypress Semiconductor Corporation,Monte Mar,2000-10-26,2001-07-18,2005-09-06,2005-09-06,https://patents.google.com/patent/US6941336B1/en,https://patentimages.storage.googleapis.com/32/69/e1/bc5245ad0ef95b/US06941336-20050906-D00000.png
US-2412485-A,Saw-tooth voltage generator ,Cossor Ltd A C,Whiteley Joseph William,1942-02-17,1943-02-05,1946-12-10,1946-12-10,https://patents.google.com/patent/US2412485A/en,https://patentimages.storage.googleapis.com/64/c2/7d/dc446e6772a181/US2412485-drawings-page-1.png
US-5384501-A,Integration circuit including a differential amplifier having a variable transconductance ,Kabushiki Kaisha Toshiba,"Mikio Koyama, Hiroshi Tanimoto",1990-06-15,1993-05-04,1995-01-24,1995-01-24,https://patents.google.com/patent/US5384501A/en,https://patentimages.storage.googleapis.com/84/23/7e/a862482a7993ff/US5384501-drawings-page-2.png
US-3698386-A,Cardiac rhythm computer device ,Robert Fried,Robert Fried,1971-07-16,1971-07-16,1972-10-17,1972-10-17,https://patents.google.com/patent/US3698386A/en,https://patentimages.storage.googleapis.com/cc/73/5d/c447a1497b45e4/US3698386-drawings-page-2.png
US-4086653-A,Pneumatic pump monitor ,Thermo Electron Corporation,David B. Gernes,1976-01-09,1976-01-09,1978-04-25,1978-04-25,https://patents.google.com/patent/US4086653A/en,https://patentimages.storage.googleapis.com/f7/8a/e7/55ddf320e90c3f/US4086653-drawings-page-2.png
US-3933305-A,Asset value calculators ,John Michael Murphy,John Michael Murphy,1974-08-23,1974-08-23,1976-01-20,1976-01-20,https://patents.google.com/patent/US3933305A/en,https://patentimages.storage.googleapis.com/2f/cf/99/70e25aa8c383c1/US3933305-drawings-page-2.png
US-8224632-B2,Virtual prototyping and testing for medical device development ,"Trivascular, Inc.","Robert G. Whirley, Michael V. Chobotov",2000-10-04,2010-10-14,2012-07-17,2012-07-17,https://patents.google.com/patent/US8224632B2/en,https://patentimages.storage.googleapis.com/8b/62/93/35d5d870b4ab3f/US08224632-20120717-D00000.png
US-4156283-A,Multiplier circuit ,"Tektronix, Inc.",Barrie Gilbert,1972-05-30,1977-10-03,1979-05-22,1979-05-22,https://patents.google.com/patent/US4156283A/en,https://patentimages.storage.googleapis.com/82/30/48/0cae8eb82d560b/US4156283-drawings-page-2.png
US-6784824-B1,Analog-to-digital converter which is substantially independent of capacitor mismatch ,"Xilinx, Inc.",Patrick J. Quinn,2002-08-29,2002-08-29,2004-08-31,2004-08-31,https://patents.google.com/patent/US6784824B1/en,https://patentimages.storage.googleapis.com/9b/b4/8f/9b4a0d9b9d0e4e/US06784824-20040831-D00000.png
US-8229791-B2,"Methods, systems, and computer integrated program products for supply chain management ",The Boeing Company,"Randolph L. Bradley, Alex Safavi, Stephen D. King, Jenny B. Thompson, Vikas Sinha, Chandler H. Wilson",2005-11-29,2006-01-30,2012-07-24,2012-07-24,https://patents.google.com/patent/US8229791B2/en,https://patentimages.storage.googleapis.com/c7/3c/42/199dddfd71a022/US08229791-20120724-D00000.png
US-5506795-A,Apparatus and method for generating chaotic signals and chaos device ,Yamakawa; Takeshi,Takeshi Yamakawa,1992-02-21,1993-02-18,1996-04-09,1996-04-09,https://patents.google.com/patent/US5506795A/en,https://patentimages.storage.googleapis.com/95/f5/46/daac6cc7b6cd2d/US5506795-drawings-page-2.png
US-2431396-A,Current magnitude-ratio responsive amplifier ,Rca Corp,Clarence W Hansell,1942-12-21,1942-12-21,1947-11-25,1947-11-25,https://patents.google.com/patent/US2431396A/en,https://patentimages.storage.googleapis.com/32/fb/5c/46baf077f3f394/US2431396-drawings-page-1.png
US-2697201-A,Adjustable nonlinear resistance ,Westinghouse Electric Corp,Edwin L Harder,1949-09-27,1949-09-27,1954-12-14,1954-12-14,https://patents.google.com/patent/US2697201A/en,https://patentimages.storage.googleapis.com/71/a2/e9/e78c29c6bfbef9/US2697201-drawings-page-1.png
US-3701147-A,Surface wave devices for signal processing ,Us Navy,Harper John Whitehouse,1969-01-22,1971-02-03,1972-10-24,1972-10-24,https://patents.google.com/patent/US3701147A/en,https://patentimages.storage.googleapis.com/d6/75/6c/d8a1929863c277/US3701147-drawings-page-2.png
US-4293920-A,Two-dimensional transform processor ,Merola Pasquale A,Pasquale A. Merola,1979-09-04,1979-09-04,1981-10-06,1981-10-06,https://patents.google.com/patent/US4293920A/en,https://patentimages.storage.googleapis.com/a6/52/d2/6dba0a59fcc07b/US4293920-drawings-page-2.png
US-6255889-B1,Mixer using four quadrant multiplier with reactive feedback elements ,Nokia Networks Oy,Roger Branson,1999-11-09,1999-11-09,2001-07-03,2001-07-03,https://patents.google.com/patent/US6255889B1/en,https://patentimages.storage.googleapis.com/99/60/b3/9ab2f64cd06c77/US6255889-drawings-page-2.png
EP-0047409-B1,Offset compensation for switched capacitor integrators ,"American Microsystems, Incorporated",Yusuf A. Haque,1980-09-08,1981-08-18,1986-03-12,1986-03-12,https://patents.google.com/patent/EP0047409B1/en,https://patentimages.storage.googleapis.com/73/6e/49/90e7e2e173c58b/imgf0001.png
US-6525593-B1,Method and apparatus for local and global power management in a programmable analog circuit ,Cypress Semiconductor Corporation,Monte Mar,2000-10-26,2001-08-22,2003-02-25,2003-02-25,https://patents.google.com/patent/US6525593B1/en,https://patentimages.storage.googleapis.com/a2/af/74/28e1ed24abe179/US06525593-20030225-D00000.png
US-3961172-A,Real-time cross-correlation signal processor ,Robert Stewart Hutcheon,Robert Stewart Hutcheon,1973-12-03,1974-12-05,1976-06-01,1976-06-01,https://patents.google.com/patent/US3961172A/en,https://patentimages.storage.googleapis.com/fc/75/a1/0322285352afd2/US3961172-drawings-page-2.png
US-2268197-A,Electron discharge device ,Bell Telephone Labor Inc,John R Pierce,1939-12-02,1940-02-17,1941-12-30,1941-12-30,https://patents.google.com/patent/US2268197A/en,https://patentimages.storage.googleapis.com/c2/fb/aa/a7d912e3a6967f/US2268197-drawings-page-1.png
US-2434561-A,Color facsimile ,Interchem Corp,"Arthur C Hardy, Edward C Dench",1944-07-08,1946-08-06,1948-01-13,1948-01-13,https://patents.google.com/patent/US2434561A/en,https://patentimages.storage.googleapis.com/da/e0/97/b57b02e615aeac/US2434561-drawings-page-1.png
CA-1128661-A,System for providing an indication of wind shear ,"Leonard M. Greene, Safe Flight Instrument Corporation",Leonard M. Greene,1977-02-07,1978-02-07,1982-07-27,1982-07-27,https://patents.google.com/patent/CA1128661A/en,
US-3510666-A,Turbidity meter having calibrating light source ,Bowser Inc,George J Topol,1967-05-05,1967-05-05,1970-05-05,1970-05-05,https://patents.google.com/patent/US3510666A/en,https://patentimages.storage.googleapis.com/24/63/4b/294050dff49da7/US3510666-drawings-page-1.png
US-2401779-A,Summing amplifier ,Bell Telephone Labor Inc,Jr Karl D Swartzel,1941-05-01,1941-05-01,1946-06-11,1946-06-11,https://patents.google.com/patent/US2401779A/en,https://patentimages.storage.googleapis.com/79/cf/c3/3e2eb60e751c1c/US2401779-drawings-page-1.png
US-8352424-B2,System and method for managing replicas of objects in a distributed storage system ,Google Inc.,"Yonatan Zunger, Alexandre Drobychev, Alexander Kesselman, Rebekah C. Vickrey, Frank C. Dachille, George Datuashvili",2010-02-09,2011-02-07,2013-01-08,2013-01-08,https://patents.google.com/patent/US8352424B2/en,https://patentimages.storage.googleapis.com/05/fc/19/2a2d23f6d85f5a/US08352424-20130108-D00000.png
JP-6205659-B2,"Process, temperature, and insensitivity of the rf power detection circuit to variations in the load impedance ","マーベル ワールド トレード リミテッド, マーベル  ワールド  トレード  リミテッド","ウィノト、レナルディ, エム． サインオフ、デービッド, エム． サインオフ、デービッド",2011-12-15,2012-12-13,2017-10-04,2017-10-04,https://patents.google.com/patent/JP6205659B2/en,https://patentimages.storage.googleapis.com/59/ac/bf/54101b274d6d46/0006205659-11.png
US-3747087-A,Digitally controlled computer animation generating system ,Computer Image Corp,"L Harrison, F Honey, E Tajchman, M Parker",1971-06-25,1971-06-25,1973-07-17,1973-07-17,https://patents.google.com/patent/US3747087A/en,https://patentimages.storage.googleapis.com/e5/c5/a6/d3f6c4049424ad/US3747087-drawings-page-2.png
US-4120035-A,Electrically reprogrammable transversal filter using charge coupled devices ,International Business Machines Corporation,"Moises Cases, Fung Yuel Chang, Barry Jay Rubin",1977-08-16,1977-08-16,1978-10-10,1978-10-10,https://patents.google.com/patent/US4120035A/en,https://patentimages.storage.googleapis.com/44/cd/25/d3d86f67241102/US4120035-drawings-page-2.png
US-5172068-A,Third-order predistortion linearization circuit ,Amoco Corporation,Richard B. Childs,1990-09-17,1991-05-21,1992-12-15,1992-12-15,https://patents.google.com/patent/US5172068A/en,https://patentimages.storage.googleapis.com/59/33/d4/8c8f355bccba82/US5172068-drawings-page-2.png
US-7092980-B1,Programming architecture for a programmable analog system ,Cypress Semiconductor Corporation,"Monte Mar, Warren Snyder",2000-10-26,2001-08-14,2006-08-15,2006-08-15,https://patents.google.com/patent/US7092980B1/en,https://patentimages.storage.googleapis.com/US7092980B1/US07092980-20060815-D00000.png
US-4675839-A,Receiver for a spread spectrum communication system having a time-multiplexed convolver ,Allied Corporation,Leo A. Kerr,1985-04-10,1985-04-10,1987-06-23,1987-06-23,https://patents.google.com/patent/US4675839A/en,https://patentimages.storage.googleapis.com/4d/9b/dc/31e97986a6c16d/US4675839-drawings-page-2.png
US-2969042-A,Cylinder adder ,Ibm,"Frank A Litz, John J Lynott",1957-07-26,1957-07-26,1961-01-24,1961-01-24,https://patents.google.com/patent/US2969042A/en,https://patentimages.storage.googleapis.com/ba/f9/4c/861e0140c16f1d/US2969042-drawings-page-1.png
US-6946902-B2,Filtering variable offset amplifier ,Intel Corporation,"James E. Jaussi, Bryan K. Casper, Aaron K. Martin",2002-01-07,2003-07-24,2005-09-20,2005-09-20,https://patents.google.com/patent/US6946902B2/en,https://patentimages.storage.googleapis.com/3f/f7/0f/67aa1687884cea/US06946902-20050920-D00000.png
US-4331869-A,Dynamic cardiac quality assurance phantom system and method ,"Capintec, Inc.",Frank D. Rollo,1980-06-23,1980-06-23,1982-05-25,1982-05-25,https://patents.google.com/patent/US4331869A/en,https://patentimages.storage.googleapis.com/fa/66/f3/63812562c1b970/US4331869-drawings-page-2.png
US-9069995-B1,Multiply accumulate operations in the analog domain ,"Kandou Labs, S.A.",Harm Cronie,2013-02-21,2013-02-21,2015-06-30,2015-06-30,https://patents.google.com/patent/US9069995B1/en,https://patentimages.storage.googleapis.com/d3/ff/b2/ff92f39c166ae3/US09069995-20150630-D00000.png
US-3845276-A,Laser-sight and computer for anti-aircraft gun fire control system ,Hughes Aircraft Co,"L Kendy, R Frey",1971-12-17,1971-12-17,1974-10-29,1974-10-29,https://patents.google.com/patent/US3845276A/en,https://patentimages.storage.googleapis.com/c6/68/a8/989aff83b0054d/US3845276-drawings-page-2.png
US-3654560-A,Drift compensated circuit ,Keithley Instruments,"Pieter G Cath, Maurice S Klapfish",1970-06-26,1970-06-26,1972-04-04,1972-04-04,https://patents.google.com/patent/US3654560A/en,https://patentimages.storage.googleapis.com/c7/06/3d/533e173d9d7672/US3654560-drawings-page-2.png
US-9369938-B2,Subscriber identity module (SIM) for mobile stations ,"Microsoft Technology Licensing, Llc","Todd S. Biggs, Robert E. Rapp, Alois Widmann",2009-03-31,2009-03-31,2016-06-14,2016-06-14,https://patents.google.com/patent/US9369938B2/en,https://patentimages.storage.googleapis.com/f3/f7/41/d95dff28f3a01f/US09369938-20160614-D00000.png
US-2708368-A,"Equipment for rating by volume, weight, and zone ",Continental Silver Co Inc,Kolisch Emil,1950-12-21,1950-12-21,1955-05-17,1955-05-17,https://patents.google.com/patent/US2708368A/en,https://patentimages.storage.googleapis.com/45/4b/f7/a22e58bbf7a374/US2708368-drawings-page-1.png
US-3959582-A,Solid state electronically rotatable raster scan for television cameras ,The United States Of America As Represented By The Secretary Of The Navy,"Robert L. Law, Paul S. Catano",1975-03-31,1975-03-31,1976-05-25,1976-05-25,https://patents.google.com/patent/US3959582A/en,https://patentimages.storage.googleapis.com/c9/9a/33/febbd36be8485c/US3959582-drawings-page-2.png
US-2465624-A,Computer device for solving trigonometric problems ,Arma Corp,Agins George,1940-07-18,1946-12-06,1949-03-29,1949-03-29,https://patents.google.com/patent/US2465624A/en,https://patentimages.storage.googleapis.com/22/44/43/0dbd34d6c8e80b/US2465624-drawings-page-1.png
US-2472129-A,Radio navigation system ,Sperry Corp,Jr Edward C Streeter,1943-08-04,1943-08-04,1949-06-07,1949-06-07,https://patents.google.com/patent/US2472129A/en,https://patentimages.storage.googleapis.com/1c/a8/ee/b3ff3414d74181/US2472129-drawings-page-1.png
US-3434062-A,Drift detector ,James R Cox,James R Cox,1965-06-21,1965-06-21,1969-03-18,1969-03-18,https://patents.google.com/patent/US3434062A/en,https://patentimages.storage.googleapis.com/f1/de/4f/c740a5bda2de8c/US3434062-drawings-page-1.png
JP-3333239-B2,Variable gain circuit ,株式会社東芝,"幹雄 小山, 正 新井",1991-12-05,1992-07-31,2002-10-15,2002-10-15,https://patents.google.com/patent/JP3333239B2/en,
US-6304128-B1,Continuous time capacitor-tuner integrator ,"Lucent Technologies, Inc.",Dima David Shulman,1997-10-10,2000-02-10,2001-10-16,2001-10-16,https://patents.google.com/patent/US6304128B1/en,https://patentimages.storage.googleapis.com/1a/02/ec/495ea3c3968273/US06304128-20011016-D00000.png
US-7979257-B2,Apparatus and methods for performing process simulation using a hybrid model ,Moldflow Netherlands Limited,"Huagang Yu, Peter Kennedy",2003-02-05,2007-12-20,2011-07-12,2011-07-12,https://patents.google.com/patent/US7979257B2/en,https://patentimages.storage.googleapis.com/ad/a7/1d/47c349949d8d29/US07979257-20110712-D00000.png
US-3714462-A,Multiplier circuits ,D Blackmer,D Blackmer,1971-06-14,1971-06-14,1973-01-30,1973-01-30,https://patents.google.com/patent/US3714462A/en,https://patentimages.storage.googleapis.com/8e/d1/16/32550f0bf91c45/US3714462-drawings-page-2.png
US-3759109-A,Multi-time constant pneumatic analogue decompression instruments ,Gen Electric,"L Johnson, M Borom",1971-09-16,1971-09-16,1973-09-18,1973-09-18,https://patents.google.com/patent/US3759109A/en,https://patentimages.storage.googleapis.com/db/eb/4f/476e03d6e3d05b/US3759109-drawings-page-2.png
US-5140692-A,Document retrieval system using analog signal comparisons for retrieval conditions including relevant keywords ,"Ricoh Company, Ltd.",Tetsuya Morita,1989-06-13,1990-06-06,1992-08-18,1992-08-18,https://patents.google.com/patent/US5140692A/en,https://patentimages.storage.googleapis.com/87/56/29/47fc3c8745ccbf/US5140692-drawings-page-2.png
US-4087568-A,Method and apparatus for controlling a material treater at maximum throughput with air velocity control ,Formica Corporation,"Charles Robert Fay, Raymond Joseph Williams",1977-07-01,1977-07-01,1978-05-02,1978-05-02,https://patents.google.com/patent/US4087568A/en,https://patentimages.storage.googleapis.com/65/d8/fa/b7d627ced61aa9/US4087568-drawings-page-2.png
US-3152250-A,"Circuit for performing the combined functions of the extraction of roots, multiplicaton, and division ",Chrysler Corp,Jr George E Platzer,1962-01-08,1962-07-20,1964-10-06,1964-10-06,https://patents.google.com/patent/US3152250A/en,https://patentimages.storage.googleapis.com/e1/54/aa/4e6c128eace323/US3152250-drawings-page-1.png
US-3667055-A,Integrating network using at least one d-c amplifier ,Iwatsu Electric Co Ltd,Kozo Uchida,1969-06-03,1970-06-24,1972-05-30,1972-05-30,https://patents.google.com/patent/US3667055A/en,https://patentimages.storage.googleapis.com/82/48/c8/b1595eb6e674d9/US3667055-drawings-page-2.png
US-8875059-B2,Control of a device using gestures ,Google Inc.,David T. Santoro,2011-05-18,2011-09-30,2014-10-28,2014-10-28,https://patents.google.com/patent/US8875059B2/en,https://patentimages.storage.googleapis.com/9f/2b/09/3c54f6fdb5da4f/US08875059-20141028-D00000.png
US-6910126-B1,Programming methodology and architecture for a programmable analog system ,"Cypress Microsystems, Inc.","Monte Mar, Warren Snyder",2000-10-26,2001-08-14,2005-06-21,2005-06-21,https://patents.google.com/patent/US6910126B1/en,https://patentimages.storage.googleapis.com/7f/6c/c3/ad09e44bd8e1d1/US06910126-20050621-D00000.png
US-2556200-A,Electrical translation system ,Int Standard Electric Corp,Lesti Arnold,1948-02-26,1948-02-26,1951-06-12,1951-06-12,https://patents.google.com/patent/US2556200A/en,https://patentimages.storage.googleapis.com/18/1a/55/ac8cdb0f67b7cb/US2556200-drawings-page-1.png
US-2916205-A,Pressure responsive mechanism ,Ibm,Frank A Litz,1956-10-19,1956-10-19,1959-12-08,1959-12-08,https://patents.google.com/patent/US2916205A/en,https://patentimages.storage.googleapis.com/a3/d9/91/e34a1edde1ee84/US2916205-drawings-page-1.png
US-2443098-A,Apparatus for determining the weight and center of gravity of vehicles ,Rca Corp,William W H Dean,1937-10-08,1944-02-28,1948-06-08,1948-06-08,https://patents.google.com/patent/US2443098A/en,https://patentimages.storage.googleapis.com/9a/26/bf/d76ca753bedf33/US2443098-drawings-page-1.png
US-2222551-A,Ratio varying device ,Askania Regulator Co,"Ziebolz Herbert, Hubert J Velten",1936-10-29,1936-10-29,1940-11-19,1940-11-19,https://patents.google.com/patent/US2222551A/en,https://patentimages.storage.googleapis.com/73/70/28/e8641ec54122bd/US2222551-drawings-page-1.png
US-6906653-B2,Digital to analog converter with a weighted capacitive circuit ,"Linear Cell Design Co., Ltd.",Masayuki Uno,2000-10-18,2003-04-09,2005-06-14,2005-06-14,https://patents.google.com/patent/US6906653B2/en,https://patentimages.storage.googleapis.com/a4/e6/20/5cafe7010eed05/US06906653-20050614-D00000.png
US-2439381-A,Computing bomb sight ,Bell Telephone Labor Inc,"Darlington Sidney, Charles H Townes, Dean E Wooldridge",1943-07-17,1943-07-17,1948-04-13,1948-04-13,https://patents.google.com/patent/US2439381A/en,https://patentimages.storage.googleapis.com/ed/92/d9/1a285c624c0280/US2439381-drawings-page-1.png
US-6157114-A,Mechanical signal processor comprising means for loss compensation ,International Business Machines Corporation,"Gerd K. Binnig, Urs T. Durig, Walter Haberle",1996-07-03,1996-07-03,2000-12-05,2000-12-05,https://patents.google.com/patent/US6157114A/en,https://patentimages.storage.googleapis.com/3b/8f/80/9fc51eb31ce435/US6157114-drawings-page-2.png
US-5841310-A,"Current-to-voltage integrator for analog-to-digital converter, and method ",Burr-Brown Corporation,"Timothy V. Kalthoff, James L. Todsen",1997-04-08,1997-04-08,1998-11-24,1998-11-24,https://patents.google.com/patent/US5841310A/en,https://patentimages.storage.googleapis.com/dd/e7/a3/c91d20070d5658/US5841310-drawings-page-2.png
US-4393351-A,Offset compensation for switched capacitor integrators ,"American Microsystems, Inc.","Roubik Gregorian, Glenn Wegner",1981-07-27,1981-07-27,1983-07-12,1983-07-12,https://patents.google.com/patent/US4393351A/en,https://patentimages.storage.googleapis.com/39/b1/96/2c9ea3850f5369/US4393351-drawings-page-2.png
US-6096088-A,Method for modelling three dimension objects and simulation of fluid flow ,Moldflow Pty Ltd,"Hua Gang Yu, Roland Thomas",1997-03-20,1997-09-17,2000-08-01,2000-08-01,https://patents.google.com/patent/US6096088A/en,https://patentimages.storage.googleapis.com/48/d5/e0/8de57912a8ba98/US6096088-drawings-page-2.png
US-3828173-A,Grain analysis computer circuit ,Dickey John Corp,J Knepler,1972-08-01,1972-08-01,1974-08-06,1974-08-06,https://patents.google.com/patent/US3828173A/en,https://patentimages.storage.googleapis.com/05/55/0d/77795cabf7f2c4/US3828173-drawings-page-2.png
US-4894620-A,Switched-capacitor circuit with large time constant ,At&T Bell Laboratories,Krishnaswamy Nagaraj,1988-04-11,1988-04-11,1990-01-16,1990-01-16,https://patents.google.com/patent/US4894620A/en,https://patentimages.storage.googleapis.com/35/22/be/102b9a2bf132f5/US4894620-drawings-page-2.png
US-6204719-B1,RMS-to-DC converter with balanced multi-tanh triplet squaring cells ,"Analog Devices, Inc.",Barrie Gilbert,1999-02-04,1999-02-04,2001-03-20,2001-03-20,https://patents.google.com/patent/US6204719B1/en,https://patentimages.storage.googleapis.com/88/5b/7f/8bc38d7f5bb668/US6204719-drawings-page-2.png
US-1573850-A,Logarithmic resistance circuit for measuring combinations of different factors ,Julius M Naiman,Julius M Naiman,1921-12-24,1921-12-24,1926-02-23,1926-02-23,https://patents.google.com/patent/US1573850A/en,https://patentimages.storage.googleapis.com/06/59/a2/84c2c08d93b9d3/US1573850-drawings-page-1.png
US-4187546-A,Computer-controlled oil drilling rig having drawworks motor and brake control arrangement ,B. J. Hughes Inc.,"James P. Heffernan, Loren B. Sheldon, James R. Tomashek, Donald H. Ward",1977-03-15,1977-03-15,1980-02-05,1980-02-05,https://patents.google.com/patent/US4187546A/en,https://patentimages.storage.googleapis.com/2a/f1/d6/354e7daf956d9c/US4187546-drawings-page-2.png
US-4338527-A,Voltage-current conversion circuit ,Tokyo Shibaura Denki Kabushiki Kaisha,Katsumi Nagano,1979-06-27,1980-06-11,1982-07-06,1982-07-06,https://patents.google.com/patent/US4338527A/en,https://patentimages.storage.googleapis.com/29/98/b6/ed2c27c3c35769/US4338527-drawings-page-2.png
US-3898439-A,System for operating industrial gas turbine apparatus and gas turbine electric power plants preferably with a digital computer control system ,Westinghouse Electric Corp,"Terry J Reed, Gerald L Rankin",1970-10-20,1970-10-20,1975-08-05,1975-08-05,https://patents.google.com/patent/US3898439A/en,https://patentimages.storage.googleapis.com/ec/5c/cd/0e214aedcc6c90/US3898439-drawings-page-2.png
US-3935439-A,Variable tap weight convolution filter ,Texas Instruments Incorporated,"Dennis Darcy Buss, Walter Howard Bailey",1974-07-12,1974-07-12,1976-01-27,1976-01-27,https://patents.google.com/patent/US3935439A/en,https://patentimages.storage.googleapis.com/f2/ee/67/52af7e593c6aa0/US3935439-drawings-page-2.png
US-3662374-A,Automatic generation of a mouth display and animation of the mouth in response to sound ,Computer Image Corp,"Lee Harrison, Francis J Honey, Edwin J Tajchman, Lloyd W Bowles",1970-07-13,1970-07-13,1972-05-09,1972-05-09,https://patents.google.com/patent/US3662374A/en,https://patentimages.storage.googleapis.com/f1/0e/00/0ee5ff1d958490/US3662374-drawings-page-2.png
US-3916170-A,Air-fuel ratio feed back type fuel injection control system ,Nippon Denso Co,"Hideaki Norimatsu, Susumu Harada",1973-04-25,1974-04-23,1975-10-28,1975-10-28,https://patents.google.com/patent/US3916170A/en,https://patentimages.storage.googleapis.com/46/bb/c1/efc0bfee784fe3/US3916170-drawings-page-2.png
US-2999482-A,Digital fluid control system ,North American Aviation Inc,John L Bower,1957-04-15,1957-04-15,1961-09-12,1961-09-12,https://patents.google.com/patent/US2999482A/en,https://patentimages.storage.googleapis.com/04/03/ba/5bd6bd03ef29ef/US2999482-drawings-page-1.png
US-3749892-A,Accountancy system ,Qeleg Ltd,P Stenning,1971-02-16,1972-02-16,1973-07-31,1973-07-31,https://patents.google.com/patent/US3749892A/en,https://patentimages.storage.googleapis.com/f4/3c/e7/772bb5e6137a0d/US3749892-drawings-page-2.png
EP-2472391-B1,System for analyzing models of dry pipe systems ,Tyco Fire Products LP,"Michael Flax, James Golinveaux, Vitaly Kabashnikov, Michael Mahomet, Valeri Mourachko, Leonid Nikolaychik, Alexander Nikolayev, Valery Popov, Andrey Bril, Valery Babenko, Thomas Prymark",2002-05-20,2003-05-20,2016-10-26,2016-10-26,https://patents.google.com/patent/EP2472391B1/en,https://patentimages.storage.googleapis.com/2f/0f/98/71efa40a55c782/imgf0001.png
US-4023565-A,Circuit arrangement for the processing of physiological measuring signals ,Siemens Aktiengesellschaft,Thomas Ohlsson,1974-06-21,1975-06-19,1977-05-17,1977-05-17,https://patents.google.com/patent/US4023565A/en,https://patentimages.storage.googleapis.com/17/da/81/acbb76fb8a80e9/US4023565-drawings-page-2.png
