id,title,assignee,inventor/author,priority date,filing/creation date,publication date,grant date,result link,representative figure link
US-3634669-A,Analog computation of insurance and investment quantities ,Aero Flow Dynamics Inc,"Charles A Soumas, David J Spontak",1969-07-16,1969-07-16,1972-01-11,1972-01-11,https://patents.google.com/patent/US3634669A/en,https://patentimages.storage.googleapis.com/9e/aa/db/c828d883e31515/US3634669-drawings-page-2.png
US-3605775-A,Method to control dosage of additive into treatment process and automatic device therefor ,Gen Am Transport,"Carl J Zaander, Veljko Milenkovic, Bernard A Johnson",1969-11-18,1969-11-18,1971-09-20,1971-09-20,https://patents.google.com/patent/US3605775A/en,https://patentimages.storage.googleapis.com/f8/a3/17/0cddcf9f7fc71d/US3605775-drawings-page-1.png
US-3520071-A,Anesthesiological training simulator ,Aerojet General Co,"Stephen Abrahamson, Judson S Denson, Alfred P Clark, Leonard Taback, Tullio Ronzoni",1968-01-29,1968-01-29,1970-07-14,1970-07-14,https://patents.google.com/patent/US3520071A/en,https://patentimages.storage.googleapis.com/67/45/12/c392f1770719b1/US3520071-drawings-page-1.png
US-3575085-A,Advanced fire control system ,Hughes Aircraft Co,William E Mcadam Jr,1968-08-21,1968-08-21,1971-04-13,1971-04-13,https://patents.google.com/patent/US3575085A/en,https://patentimages.storage.googleapis.com/11/ad/4b/3be9c2fdffc894/US3575085-drawings-page-2.png
JP-5677697-B2,Active phased-array architecture ,ビアサット・インコーポレイテッド,"デイビッド ダブリュー． コーマン，, デイビッド  ダブリュー． コーマン，, ケネス ブイ． ブーアー，, ケネス  ブイ． ブーアー，, ドナルド ローソン ランヨン，, ドナルド  ローソン ランヨン，, ステファーノ ヴァカロ，, ステファーノ ヴァカロ，, フェルディナンド ティエッツィ，, フェルディナンド ティエッツィ，, デル リオ， ダニエル ジョレンス, デル  リオ，  ダニエル ジョレンス, ドン クロケット，, ドン クロケット，",2009-04-13,2010-04-13,2015-02-25,2015-02-25,https://patents.google.com/patent/JP5677697B2/en,https://patentimages.storage.googleapis.com/05/72/88/fa50aeca326b87/0005677697-2.png
JP-5850588-B2,Method and system for patient-specific blood flow modeling ,"ハートフロー， インコーポレイテッド, ハートフロー，  インコーポレイテッド","エー． テイラー チャールズ, エー．  テイラー チャールズ, エー． フォンテ ティモシー, エー．  フォンテ ティモシー, ギルウー チョイ, ギルウー チョイ, イン バイ, イン バイ, ケイ． ザリンス クリストファー, ケイ．  ザリンス クリストファー",2010-08-12,2014-11-06,2016-02-03,2016-02-03,https://patents.google.com/patent/JP5850588B2/en,https://patentimages.storage.googleapis.com/JP5850588B2/0005850588.png
JP-4550945-B2,Force sensitive tactile interface ,マサチューセッツ  インスティテュート  オブ  テクノロジー,"ジュニア サリスバリー，ジェイ．ケネス, エイチ． マッシー，トーマス",1993-10-01,1994-09-22,2010-09-22,2010-09-22,https://patents.google.com/patent/JP4550945B2/en,https://patentimages.storage.googleapis.com/83/73/d8/8206d4b292818d/0004550945-3.png
US-3223321-A,Portable household budget computer ,Baumgartner Walter,Baumgartner Walter,1965-03-16,1965-03-16,1965-12-14,1965-12-14,https://patents.google.com/patent/US3223321A/en,https://patentimages.storage.googleapis.com/fc/78/54/3d8b5a4222bc05/US3223321-drawings-page-1.png
US-3555262-A,Apparatus for production of color separation records ,Dainippon Screen Mfg,Shoichi Shimada,1968-05-07,1968-05-07,1971-01-12,1971-01-12,https://patents.google.com/patent/US3555262A/en,https://patentimages.storage.googleapis.com/0d/5a/a6/a6c4208fed1f62/US3555262-drawings-page-2.png
US-3554187-A,Method and apparatus for automatically screening of electrocardiac signals ,Humetrics Corp,"Harvey F Glassner, Clinton O Jorgensen, Lee R Baessler",1965-10-21,1965-10-21,1971-01-12,1971-01-12,https://patents.google.com/patent/US3554187A/en,https://patentimages.storage.googleapis.com/e0/b4/8a/616fda06e19868/US3554187-drawings-page-2.png
US-3541320-A,Drift compensation for integrating amplifiers ,Gen Electric,William H Beall,1968-08-07,1968-08-07,1970-11-17,1970-11-17,https://patents.google.com/patent/US3541320A/en,https://patentimages.storage.googleapis.com/bf/76/36/d4a61cdbd044ea/US3541320-drawings-page-1.png
US-3380851-A,Nonwoven fabric with vinyl acetateethylene-n-methylol acrylamide interpolymer as binder ,Air Reduction,"Martin K Lindemann, Rocco P Volpe",1965-03-31,1965-03-31,1968-04-30,1968-04-30,https://patents.google.com/patent/US3380851A/en,
US-3109588-A,Celestial computers ,"William L Polhemus, Lewis M Bostick","William L Polhemus, Lewis M Bostick",1962-01-26,1962-01-26,1963-11-05,1963-11-05,https://patents.google.com/patent/US3109588A/en,https://patentimages.storage.googleapis.com/55/ac/0b/6ad42f2b7fcd5a/US3109588-drawings-page-1.png
US-3592099-A,Slide rule for computing musical relationships ,Delbert F Gibby,Delbert F Gibby,1969-04-11,1969-04-11,1971-07-13,1971-07-13,https://patents.google.com/patent/US3592099A/en,https://patentimages.storage.googleapis.com/75/48/56/23fab689cb7527/US3592099-drawings-page-2.png
US-3483951-A,Self-optimizing vibration dampers ,Wisconsin Alumni Res Found,"James A Bonesho, John Gustave Bollinger",1968-12-06,1968-12-06,1969-12-16,1969-12-16,https://patents.google.com/patent/US3483951A/en,https://patentimages.storage.googleapis.com/39/ae/cd/d4fc1dee3ef980/US3483951-drawings-page-1.png
US-3320409-A,Electronic plotting device ,Burroughs Corp,Boyd T Larrowe,1963-01-30,1963-01-30,1967-05-16,1967-05-16,https://patents.google.com/patent/US3320409A/en,https://patentimages.storage.googleapis.com/44/89/2e/b7be4299d2f760/US3320409-drawings-page-1.png
US-3418459-A,Graphic construction display generator ,Gen Electric,"William C Purdy, Charles G Schnorr",1959-11-25,1967-06-16,1968-12-24,1968-12-24,https://patents.google.com/patent/US3418459A/en,https://patentimages.storage.googleapis.com/d2/8b/3c/205dca097cd299/US3418459-drawings-page-1.png
US-3660648-A,Angular rate coordinate transformer ,Northrop Corp,Jack Kuipers,1969-10-15,1969-10-15,1972-05-02,1972-05-02,https://patents.google.com/patent/US3660648A/en,https://patentimages.storage.googleapis.com/33/3d/f5/4d5582391fc053/US3660648-drawings-page-2.png
US-3614410-A,Image rectifier ,"Knight V Bailey, Dudley P Hattaway","Knight V Bailey, Dudley P Hattaway",1969-06-12,1969-06-12,1971-10-19,1971-10-19,https://patents.google.com/patent/US3614410A/en,https://patentimages.storage.googleapis.com/7c/e1/28/c8a95cc026b7ae/US3614410-drawings-page-2.png
US-3502905-A,Differential amplifier and field effect transistor gates for applying largest of two inputs to output ,Honeywell Inc,Robert E Bicking,1967-05-17,1967-05-17,1970-03-24,1970-03-24,https://patents.google.com/patent/US3502905A/en,https://patentimages.storage.googleapis.com/fa/2f/5e/7af65121065c9c/US3502905-drawings-page-1.png
US-3309642-A,Hall effect rotating device ,Csf Cie Generale De Teiegraphi,Grancoin Bernard,1963-07-05,1964-07-01,1967-03-14,1967-03-14,https://patents.google.com/patent/US3309642A/en,https://patentimages.storage.googleapis.com/ef/93/66/e34e25fcb0c83b/US3309642-drawings-page-1.png
US-3316395-A,Credit risk computer ,Credit Corp Comp,Michael G Lavin,1963-05-23,1963-05-23,1967-04-25,1967-04-25,https://patents.google.com/patent/US3316395A/en,https://patentimages.storage.googleapis.com/42/f6/0a/f10208a608629b/US3316395-drawings-page-1.png
US-3155825-A,Pure fluid logic circuitry for integrators and differentiators ,Gen Electric,Willis A Boothe,1963-02-21,1963-02-21,1964-11-03,1964-11-03,https://patents.google.com/patent/US3155825A/en,https://patentimages.storage.googleapis.com/23/d9/32/dd8f4da6e1e917/US3155825-drawings-page-1.png
US-3593115-A,Capacitive voltage divider ,Ibm,"Herbert Dym, Robert V Mazza",1969-06-30,1969-09-10,1971-07-13,1971-07-13,https://patents.google.com/patent/US3593115A/en,https://patentimages.storage.googleapis.com/6d/fe/7b/5b54941843ecd7/US3593115-drawings-page-2.png
US-3474241-A,Coordinate transformer ,Jack Kuipers,Jack Kuipers,1966-10-06,1966-10-06,1969-10-21,1969-10-21,https://patents.google.com/patent/US3474241A/en,https://patentimages.storage.googleapis.com/b4/d1/a1/59e6e5531f82b0/US3474241-drawings-page-1.png
US-3341816-A,Amplitude range signal monitoring device ,Hughes Aircraft Co,"Jack T Davis, William H Hill",1964-03-20,1964-03-20,1967-09-12,1967-09-12,https://patents.google.com/patent/US3341816A/en,https://patentimages.storage.googleapis.com/50/b2/4c/75b0afeac5ce20/US3341816-drawings-page-1.png
US-3513327-A,Low impedance pulse generator ,Owens Illinois Inc,William E Johnson,1968-01-19,1968-08-14,1970-05-19,1970-05-19,https://patents.google.com/patent/US3513327A/en,https://patentimages.storage.googleapis.com/59/63/74/d93d8f0be4ce7f/US3513327-drawings-page-1.png
US-3174032-A,Adapting quantized filter ,Gen Electric,Gerald M White,1960-02-08,1960-10-06,1965-03-16,1965-03-16,https://patents.google.com/patent/US3174032A/en,https://patentimages.storage.googleapis.com/e6/09/3a/eb707a71b3172f/US3174032-drawings-page-1.png
US-3433935-A,Apparatus for computation particularly adapted for producing a measure of transit time and the like ,Herbert Sherman,Herbert Sherman,1963-07-12,1963-07-12,1969-03-18,1969-03-18,https://patents.google.com/patent/US3433935A/en,https://patentimages.storage.googleapis.com/da/8a/68/3200e02b03f868/US3433935-drawings-page-1.png
US-3265960-A,Capacitive resolver ,Benjamin P Blasingame,Benjamin P Blasingame,1959-10-08,1964-10-16,1966-08-09,1966-08-09,https://patents.google.com/patent/US3265960A/en,https://patentimages.storage.googleapis.com/25/35/83/4001ddcc6011ee/US3265960-drawings-page-1.png
US-3378676-A,System employing plural time-spaced average computations for measuring a second variable characteristic imparted to a material initially having a first variable characteristic ,Industrial Nucleonics Corp,John C Clement,1963-07-16,1963-07-16,1968-04-16,1968-04-16,https://patents.google.com/patent/US3378676A/en,https://patentimages.storage.googleapis.com/75/4f/41/7c1bb539a2e105/US3378676-drawings-page-1.png
US-3668545-A,Apparatus for amplifier protection ,Scott Inc H H,Daniel R Von Recklinghausen,1969-11-03,1969-11-03,1972-06-06,1972-06-06,https://patents.google.com/patent/US3668545A/en,https://patentimages.storage.googleapis.com/ae/52/4e/de8a2bb325fe3e/US3668545-drawings-page-2.png
US-3298973-A,Phenolic foam compositions ,Union Carbide Corp,"Richard W Quarles, John A Baumann",1963-10-10,1963-10-10,1967-01-17,1967-01-17,https://patents.google.com/patent/US3298973A/en,
US-3208065-A,Impulse correlation function generator ,Itt,"Frank S Gutleber, Robert S Bailey",1963-07-24,1963-07-24,1965-09-21,1965-09-21,https://patents.google.com/patent/US3208065A/en,https://patentimages.storage.googleapis.com/1f/00/0a/29486adaf18be7/US3208065-drawings-page-1.png
US-3513707-A,Golf game computing system ,Brunswick Corp,"Jack A Russell, Bradford J Baldwin",1966-10-24,1966-10-24,1970-05-26,1970-05-26,https://patents.google.com/patent/US3513707A/en,https://patentimages.storage.googleapis.com/c7/3d/f4/87a3a129e2b933/US3513707-drawings-page-1.png
US-3626168-A,"Measuring correlation, amplitude probability and probability density distributions, and signal response averaging ",Boeing Co,Keith H Norsworthy,1969-07-07,1969-07-07,1971-12-07,1971-12-07,https://patents.google.com/patent/US3626168A/en,https://patentimages.storage.googleapis.com/39/dd/df/a1da21d074b109/US3626168-drawings-page-2.png
US-3612845-A,Computer utilizing random pulse trains ,Reed C Lawlor,Reed C Lawlor,1968-07-05,1968-07-05,1971-10-12,1971-10-12,https://patents.google.com/patent/US3612845A/en,https://patentimages.storage.googleapis.com/98/79/c3/d2dae5b297ed22/US3612845-drawings-page-2.png
US-3237318-A,Apparatus for simulating the operation of an electrical power generating plant ,Arthur J Schager,Arthur J Schager,1963-07-23,1963-07-23,1966-03-01,1966-03-01,https://patents.google.com/patent/US3237318A/en,https://patentimages.storage.googleapis.com/05/40/0b/51ce3fd2cfe6ba/US3237318-drawings-page-1.png
US-3474260-A,Time domain equalizer using analog shift register ,South Pacific Co,Hugh F Frohbach,1966-10-10,1966-10-10,1969-10-21,1969-10-21,https://patents.google.com/patent/US3474260A/en,https://patentimages.storage.googleapis.com/f2/d3/a6/e992d6153d784f/US3474260-drawings-page-1.png
US-3310789-A,Non-destructive read-out magneticcore translating matrice ,Int Standard Electric Corp,"Steinbuch Karl, Hans Juergen Hoenerloh",1960-09-23,1963-08-02,1967-03-21,1967-03-21,https://patents.google.com/patent/US3310789A/en,https://patentimages.storage.googleapis.com/71/fd/e5/0724559296b3db/US3310789-drawings-page-1.png
US-3270421-A,Construction calculating ruler ,Jones Orval,Jones Orval,1963-03-07,1963-03-07,1966-09-06,1966-09-06,https://patents.google.com/patent/US3270421A/en,https://patentimages.storage.googleapis.com/22/3a/33/f0a953171f3792/US3270421-drawings-page-1.png
US-3594556-A,Optical sight with electronic image stabilization ,Us Navy,William R Edwards,1969-01-08,1969-01-08,1971-07-20,1971-07-20,https://patents.google.com/patent/US3594556A/en,https://patentimages.storage.googleapis.com/a5/2d/58/449cfb1bf35d17/US3594556-drawings-page-2.png
US-3522739-A,Spectrophotometer apparatus utilizing a ratio measuring circuit ,Princeton Applied Res Corp,"Thomas Coor, Stuart L Ridgway",1968-10-28,1968-10-28,1970-08-04,1970-08-04,https://patents.google.com/patent/US3522739A/en,https://patentimages.storage.googleapis.com/75/89/b4/e83dc3e43f582e/US3522739-drawings-page-1.png
US-3534355-A,Load warning device ,Dole Valve Co,George H Fathauer,1967-03-28,1967-03-28,1970-10-13,1970-10-13,https://patents.google.com/patent/US3534355A/en,https://patentimages.storage.googleapis.com/9c/85/81/d2d162bf0ca937/US3534355-drawings-page-1.png
US-3256426-A,Integrating totalizer ,Roth,"Roth Wilfred, Leonard G Rich",1962-06-05,1962-06-05,1966-06-14,1966-06-14,https://patents.google.com/patent/US3256426A/en,https://patentimages.storage.googleapis.com/95/39/43/b0c62d42e34cac/US3256426-drawings-page-1.png
US-3086704-A,Cosine-secant multiplier ,Ryan Aeronautical Co,Leon E Hurtt,1961-11-24,1961-11-24,1963-04-23,1963-04-23,https://patents.google.com/patent/US3086704A/en,https://patentimages.storage.googleapis.com/af/e9/45/fe0fbe6650b29a/US3086704-drawings-page-1.png
US-3601588-A,Method and apparatus for adaptive control ,Foxboro Co,Edgar H Bristol,1966-05-23,1966-05-23,1971-08-24,1971-08-24,https://patents.google.com/patent/US3601588A/en,
US-5959871-A,Programmable analog array circuit ,Analogix/Portland State University,"Edmund Pierzchala, Marek A. Perkowski",1993-12-23,1994-12-22,1999-09-28,1999-09-28,https://patents.google.com/patent/US5959871A/en,https://patentimages.storage.googleapis.com/09/4c/35/147dfeb5e766af/US5959871-drawings-page-3.png
US-6603330-B1,Configuring digital functions in a digital configurable macro architecture ,Cypress Semiconductor Corporation,Warren Snyder,2000-10-26,2001-07-18,2003-08-05,2003-08-05,https://patents.google.com/patent/US6603330B1/en,https://patentimages.storage.googleapis.com/2b/13/94/321b03bf0e3de0/US06603330-20030805-D00000.png
US-5329281-A,Analog to digital converter with autoranging offset ,Hewlett-Packard Company,"Richard A. Baumgartner, Charles E. Moore, Earl C. Herleikson",1992-04-30,1993-04-26,1994-07-12,1994-07-12,https://patents.google.com/patent/US5329281A/en,https://patentimages.storage.googleapis.com/5b/d8/71/cc024a5f5a0a06/US5329281-drawings-page-2.png
US-9122440-B2,User feedback to indicate transitions between open and closed states ,Z124,"Ron Cassar, Mohammed Selim, Sanjiv Sirpal",2011-09-27,2012-01-09,2015-09-01,2015-09-01,https://patents.google.com/patent/US9122440B2/en,https://patentimages.storage.googleapis.com/f2/a2/4b/c16aeca2d564ff/US09122440-20150901-D00000.png
US-8639484-B2,"Method and apparatus for computer-aided tissue engineering for modeling, design and freeform fabrication of tissue scaffolds, constructs, and devices ",Drexel University,"Wei Sun, Jae Hyun Nam, Andrew Leete Darling, Saif Khalil",2003-11-14,2004-05-14,2014-01-28,2014-01-28,https://patents.google.com/patent/US8639484B2/en,https://patentimages.storage.googleapis.com/3e/54/39/650cd0705877a9/US08639484-20140128-D00000.png
US-5477481-A,Switched-capacitor integrator with chopper stabilization performed at the sampling rate ,Crystal Semiconductor Corporation,Donald A. Kerth,1991-02-15,1994-04-01,1995-12-19,1995-12-19,https://patents.google.com/patent/US5477481A/en,https://patentimages.storage.googleapis.com/c3/df/58/6acb457b4f05aa/US5477481-drawings-page-2.png
US-3636325-A,Analog-programmed control system for excavators having jibs ,Unicovske Strojirny Narodni Po,Josef Chytil,1967-09-14,1968-09-16,1972-01-18,1972-01-18,https://patents.google.com/patent/US3636325A/en,https://patentimages.storage.googleapis.com/1c/89/87/27084b15ccd708/US3636325-drawings-page-2.png
US-3052842-A,Patchcord connection aid and checking system ,Lockheed Aircraft Corp,"Frohman Robert, Jr Ralph A Post, Jr Lawrence P Faber",1959-10-15,1959-10-15,1962-09-04,1962-09-04,https://patents.google.com/patent/US3052842A/en,https://patentimages.storage.googleapis.com/c5/df/92/734455d54385b4/US3052842-drawings-page-1.png
US-7825688-B1,Programmable microcontroller architecture(mixed analog/digital) ,Cypress Semiconductor Corporation,"Warren Snyder, Monte Mar",2000-10-26,2007-04-30,2010-11-02,2010-11-02,https://patents.google.com/patent/US7825688B1/en,https://patentimages.storage.googleapis.com/US7825688B1/US07825688-20101102-D00000.png
US-3691356-A,Speed command and throttle control system for aircraft ,Sperry Rand Corp,Harry Miller,1970-12-10,1970-12-10,1972-09-12,1972-09-12,https://patents.google.com/patent/US3691356A/en,https://patentimages.storage.googleapis.com/ec/d8/c2/6b80ee4b452077/US3691356-drawings-page-2.png
US-4136387-A,Golf club impact and golf ball launching monitoring system ,Acushnet Company,"Paul F. Sullivan, Francis deS. Lynch, William Gobush, Hoyt C. Hottel, Jr.",1977-09-12,1977-09-12,1979-01-23,1979-01-23,https://patents.google.com/patent/US4136387A/en,https://patentimages.storage.googleapis.com/34/cd/cd/3d7ed15da0bc8d/US4136387-drawings-page-2.png
US-2688124-A,Method of and apparatus for determining travel time of signals ,Continental Oil Co,"William E N Doty, John M Crawford",1953-02-27,1953-02-27,1954-08-31,1954-08-31,https://patents.google.com/patent/US2688124A/en,https://patentimages.storage.googleapis.com/66/53/9f/702552efc60eb2/US2688124-drawings-page-1.png
US-5408194-A,Adaptive analog minimum/maximum selector and subtractor circuit ,"Synaptics, Incorporated","Gunter Steinbach, Timothy P. Allen, Carver A. Mead",1993-06-25,1993-06-25,1995-04-18,1995-04-18,https://patents.google.com/patent/US5408194A/en,https://patentimages.storage.googleapis.com/e8/ec/5d/83c08e12b54bd3/US5408194-drawings-page-2.png
US-5680070-A,Programmable analog array and method for configuring the same ,"Motorola, Inc.","David J. Anderson, Douglas A. Garrity",1996-02-05,1996-02-05,1997-10-21,1997-10-21,https://patents.google.com/patent/US5680070A/en,https://patentimages.storage.googleapis.com/7a/8a/5a/668fc5e22aa498/US5680070-drawings-page-2.png
US-3689752-A,Four-quadrant multiplier circuit ,Tektronix Inc,Barrie Gilbert,1970-04-13,1970-04-13,1972-09-05,1972-09-05,https://patents.google.com/patent/US3689752A/en,https://patentimages.storage.googleapis.com/40/d3/38/99261f2578e608/US3689752-drawings-page-2.png
US-7428481-B2,Efficient data representation of teeth model ,"Align Technology, Inc.","Sergey Nikolskiy, Elena Pavloskaia, Huafeng Wen",2000-02-17,2003-02-07,2008-09-23,2008-09-23,https://patents.google.com/patent/US7428481B2/en,https://patentimages.storage.googleapis.com/US7428481B2/US07428481-20080923-D00000.png
US-3513300-A,Aircraft weight and center of gravity computer ,Jack Asher Elfenbein,"Jack Asher Elfenbein, Manfred Carl Mueller",1967-08-23,1967-08-23,1970-05-19,1970-05-19,https://patents.google.com/patent/US3513300A/en,https://patentimages.storage.googleapis.com/e5/ae/c1/7e09e95111c516/US3513300-drawings-page-1.png
US-3103648-A,Adaptive neuron having improved output ,Gen Electric,Hartmanis Juris,1961-08-22,1961-08-22,1963-09-10,1963-09-10,https://patents.google.com/patent/US3103648A/en,https://patentimages.storage.googleapis.com/c1/f8/1e/67b28fd76698d7/US3103648-drawings-page-1.png
US-3314015-A,Digitally synthesized artificial transfer networks ,Bell Telephone Labor Inc,Carl F Simone,1963-09-16,1963-09-16,1967-04-11,1967-04-11,https://patents.google.com/patent/US3314015A/en,https://patentimages.storage.googleapis.com/cb/25/fd/971650893b4398/US3314015-drawings-page-1.png
US-3251052-A,Reversible analog to digital converter ,Towson Lab Inc,"Philip A Hoffman, Jr Mckenny W Egerton",1963-05-15,1963-05-15,1966-05-10,1966-05-10,https://patents.google.com/patent/US3251052A/en,https://patentimages.storage.googleapis.com/ea/bd/17/e9501bda139c4b/US3251052-drawings-page-1.png
US-3860803-A,Automatic method and apparatus for fabricating progressive dies ,Diecomp Inc,Richard Carl Levine,1970-08-24,1970-08-24,1975-01-14,1975-01-14,https://patents.google.com/patent/US3860803A/en,https://patentimages.storage.googleapis.com/37/6e/68/eb84bce705085c/US3860803-drawings-page-2.png
US-6656052-B2,Progressive gaming method ,"Frank Abramopoulos, Jennifer Spano","Frank Abramopoulos, Jennifer Spano",1998-11-19,2000-12-07,2003-12-02,2003-12-02,https://patents.google.com/patent/US6656052B2/en,https://patentimages.storage.googleapis.com/ef/71/2b/9fcf9733e027ff/US06656052-20031202-D00000.png
US-8412500-B2,Simulations for hydraulic fracturing treatments and methods of fracturing naturally fractured formation ,Schlumberger Technology Corporation,"Xiaowei Weng, Eduard Siebrits",2007-01-29,2007-11-07,2013-04-02,2013-04-02,https://patents.google.com/patent/US8412500B2/en,https://patentimages.storage.googleapis.com/83/92/80/7a51f4a4ccb326/US08412500-20130402-D00000.png
EP-1287614-B1,Circuit stimulating a diode ,"Minebea Co., Ltd.",Arian M. Jansen,2000-05-09,2001-05-04,2008-03-19,2008-03-19,https://patents.google.com/patent/EP1287614B1/en,https://patentimages.storage.googleapis.com/55/d2/65/325ae3c2aaa7f8/imgf0001.png
US-3657657-A,Digital sine wave generator ,William T Jefferson,William T Jefferson,1970-08-03,1970-08-03,1972-04-18,1972-04-18,https://patents.google.com/patent/US3657657A/en,https://patentimages.storage.googleapis.com/30/22/20/77ea0ae06ddd0d/US3657657-drawings-page-2.png
US-4112456-A,Stabilized charge injector for charge coupled devices with means for increasing the speed of propagation of charge carriers ,Westinghouse Electric Corp.,"Donald R. Lampe, Marvin H. White, Arthur S. Jensen",1974-09-17,1975-10-24,1978-09-05,1978-09-05,https://patents.google.com/patent/US4112456A/en,https://patentimages.storage.googleapis.com/64/57/8b/35b46b0ff0c53f/US4112456-drawings-page-2.png
JP-5434567-B2,Power reception guidance system ,アイシン・エィ・ダブリュ株式会社,隆博 山本,2008-12-22,2009-12-22,2014-03-05,2014-03-05,https://patents.google.com/patent/JP5434567B2/en,https://patentimages.storage.googleapis.com/b4/f3/e0/8840245a72cd7b/0005434567-2.png
US-5115409-A,Multiple-input four-quadrant multiplier ,Siemens Aktiengesellschaft,Richard Stepp,1988-08-31,1989-08-14,1992-05-19,1992-05-19,https://patents.google.com/patent/US5115409A/en,https://patentimages.storage.googleapis.com/0a/43/b5/a2207d4c5023df/US5115409-drawings-page-2.png
US-4402054-A,Method and apparatus for the automatic diagnosis of system malfunctions ,Westinghouse Electric Corp.,"Robert L. Osborne, Paul H. Haley, Stephen J. Jennings",1980-10-15,1980-10-15,1983-08-30,1983-08-30,https://patents.google.com/patent/US4402054A/en,https://patentimages.storage.googleapis.com/b7/da/4b/85a718dd3d9e18/US4402054-drawings-page-2.png
US-4446438-A,Switched capacitor n-path filter ,Gte Automatic Electric Incorporated,"Chieh Chang, Man S. Lee",1981-10-26,1981-10-26,1984-05-01,1984-05-01,https://patents.google.com/patent/US4446438A/en,https://patentimages.storage.googleapis.com/7a/1a/41/eb105756299911/US4446438-drawings-page-2.png
US-6507214-B1,Digital configurable macro architecture ,Cypress Semiconductor Corporation,Warren Snyder,2000-10-26,2001-07-18,2003-01-14,2003-01-14,https://patents.google.com/patent/US6507214B1/en,https://patentimages.storage.googleapis.com/6a/9f/bc/6ef6ceac404852/US06507214-20030114-D00000.png
US-8555032-B2,Microcontroller programmable system on a chip with programmable interconnect ,Cypress Semiconductor Corporation,Warren Snyder,2000-10-26,2011-06-27,2013-10-08,2013-10-08,https://patents.google.com/patent/US8555032B2/en,https://patentimages.storage.googleapis.com/07/27/e2/9e3789383b5957/US08555032-20131008-D00000.png
US-4896156-A,"Switched-capacitance coupling networks for differential-input amplifiers, not requiring balanced input signals ",General Electric Company,Steven L. Garverick,1988-10-03,1988-10-03,1990-01-23,1990-01-23,https://patents.google.com/patent/US4896156A/en,https://patentimages.storage.googleapis.com/ea/73/d3/3c979112a0daba/US4896156-drawings-page-2.png
US-3651318-A,Cardiac output computer ,Jan A Czekajewski,Jan A Czekajewski,1970-01-26,1970-01-26,1972-03-21,1972-03-21,https://patents.google.com/patent/US3651318A/en,https://patentimages.storage.googleapis.com/41/3b/f1/bd618c7fa70fbf/US3651318-drawings-page-2.png
US-3835840-A,Impedance plethysmography method and apparatus ,Hope City,B Mount,1973-09-27,1973-09-27,1974-09-17,1974-09-17,https://patents.google.com/patent/US3835840A/en,https://patentimages.storage.googleapis.com/6a/65/6a/d62b5e584693f2/US3835840-drawings-page-2.png
