id,title,assignee,inventor/author,priority date,filing/creation date,publication date,grant date,result link,representative figure link
US-3473008-A,System for feed blending control ,Leeds & Northrup Co,"Theodosios Bay, Tai-Seng Chen, John W Schwartzenberg",1964-06-12,1964-06-12,1969-10-14,1969-10-14,https://patents.google.com/patent/US3473008A/en,https://patentimages.storage.googleapis.com/d4/59/13/4ac1033d938b8c/US3473008-drawings-page-1.png
US-3811040-A,Vector contour plot of physiological parameters ,Gen Electric,"P Weinfurt, R Lijewski",1972-09-27,1972-09-27,1974-05-14,1974-05-14,https://patents.google.com/patent/US3811040A/en,https://patentimages.storage.googleapis.com/c6/e1/7b/70f5c56b1fc0f1/US3811040-drawings-page-2.png
US-2404387-A,Electrical computing system ,Bell Telephone Labor Inc,"Clarence A Lovell, David B Parkinson, Bruce T Weber",1941-05-01,1941-05-01,1946-07-23,1946-07-23,https://patents.google.com/patent/US2404387A/en,https://patentimages.storage.googleapis.com/45/33/e6/fa4c613fd0bcd1/US2404387-drawings-page-1.png
US-2989726-A,Method of and apparatus for determining the travel time of a vibratory signal between spaced points ,Continental Oil Co,"John M Crawford, William E N Doty",1954-04-28,1954-04-28,1961-06-20,1961-06-20,https://patents.google.com/patent/US2989726A/en,https://patentimages.storage.googleapis.com/2e/36/06/0dc9698d4575ae/US2989726-drawings-page-1.png
EP-0562653-B1,Vehicle suspension controller ,General Motors Corporation,Gary Chris Fulks,1992-03-26,1993-03-02,1995-09-20,1995-09-20,https://patents.google.com/patent/EP0562653B1/en,https://patentimages.storage.googleapis.com/b8/42/a6/0633cf4dff15fd/imgf0001.png
US-9223042-B2,Systems and methods for the quantitative estimate of production-forecast uncertainty ,Landmark Graphics Corporation,"Marko Maucec, Alvin Stanley Cullick",2009-09-25,2009-09-25,2015-12-29,2015-12-29,https://patents.google.com/patent/US9223042B2/en,https://patentimages.storage.googleapis.com/90/e4/aa/f5a074127a7917/US09223042-20151229-D00000.png
US-4217563-A,Surface wave phase correlator and monopulse radar system employing the same ,Westinghouse Electric Corp.,Christopher R. Vale,1975-12-22,1975-12-22,1980-08-12,1980-08-12,https://patents.google.com/patent/US4217563A/en,https://patentimages.storage.googleapis.com/8e/8a/d2/ca549f85a07978/US4217563-drawings-page-2.png
US-2747796-A,Computing circuits ,Sun Oil Co,Omar L Patterson,1949-11-30,1954-05-28,1956-05-29,1956-05-29,https://patents.google.com/patent/US2747796A/en,https://patentimages.storage.googleapis.com/07/4b/ff/b9f9dd73135919/US2747796-drawings-page-1.png
US-2399726-A,Apparatus for aiming guns ,,,1940-03-11,1940-03-11,1946-05-07,1946-05-07,https://patents.google.com/patent/US2399726A/en,https://patentimages.storage.googleapis.com/c8/b8/76/ef0f2d8002c163/US2399726-drawings-page-1.png
US-2676206-A,Computation and display of correlation ,Bell Telephone Labor Inc,"William R Bennett, Liss C Peterson",1951-12-06,1951-12-06,1954-04-20,1954-04-20,https://patents.google.com/patent/US2676206A/en,https://patentimages.storage.googleapis.com/3f/74/32/e49eeada1ad996/US2676206-drawings-page-1.png
US-4918643-A,Method and apparatus for substantially improving the throughput of circuit simulators ,At&T Bell Laboratories,Chiu-Seung R. Wong,1988-06-21,1988-06-21,1990-04-17,1990-04-17,https://patents.google.com/patent/US4918643A/en,https://patentimages.storage.googleapis.com/85/b1/0f/b43baaa32ecd72/US4918643-drawings-page-3.png
US-3900721-A,Serial-access linear transform ,Us Navy,"Jeffrey M Speiser, Harper John Whitehouse",1974-02-14,1974-02-14,1975-08-19,1975-08-19,https://patents.google.com/patent/US3900721A/en,https://patentimages.storage.googleapis.com/13/49/97/98e124c3c507bb/US3900721-drawings-page-2.png
US-5157350-A,Analog multipliers ,Harvey Rubens,Harvey Rubens,1991-10-31,1991-10-31,1992-10-20,1992-10-20,https://patents.google.com/patent/US5157350A/en,https://patentimages.storage.googleapis.com/57/14/25/9652b02463b8e0/US5157350-drawings-page-2.png
US-3043516-A,"Time summing device for division, multiplication, root taking and interpolation ",Gen Electric,"Harold W Abbott, Vernon P Mathis",1959-10-01,1959-10-01,1962-07-10,1962-07-10,https://patents.google.com/patent/US3043516A/en,https://patentimages.storage.googleapis.com/90/06/2a/c53d8651a2d9e3/US3043516-drawings-page-1.png
US-5479130-A,Auto-zero switched-capacitor integrator ,"Analog Devices, Inc.",Damien McCartney,1994-02-15,1994-02-15,1995-12-26,1995-12-26,https://patents.google.com/patent/US5479130A/en,https://patentimages.storage.googleapis.com/07/da/94/088c5c52cc0811/US5479130-drawings-page-2.png
US-4163947-A,Current and voltage autozeroing integrator ,Analogic Corporation,Hans J. Weedon,1977-09-23,1977-09-23,1979-08-07,1979-08-07,https://patents.google.com/patent/US4163947A/en,https://patentimages.storage.googleapis.com/c6/1e/68/c315b31e89b829/US4163947-drawings-page-2.png
US-4715064-A,Adaptive hybrid circuit ,Ncr Corporation,Albertus M. G. Claessen,1984-06-22,1984-06-22,1987-12-22,1987-12-22,https://patents.google.com/patent/US4715064A/en,https://patentimages.storage.googleapis.com/43/02/e1/01ab6fe21c7613/US4715064-drawings-page-2.png
US-6292066-B1,"Function generator, crystal oscillation device and method of adjusting crystal oscillation device ","Matsushita Electric Industrial Co., Ltd.","Shuji Shibuya, Hisato Takeuchi, Junichi Matsuura, Yuichi Tateyama, Takaharu Saeki",1997-07-11,1998-07-08,2001-09-18,2001-09-18,https://patents.google.com/patent/US6292066B1/en,https://patentimages.storage.googleapis.com/f6/31/73/a6e43d69ac48ec/US6292066-drawings-page-2.png
US-2013300341-A1,System for recharging a battery ,"Logimesh IP, LLC",II William J. Gillette,2012-05-08,2013-05-08,2013-11-14,,https://patents.google.com/patent/US20130300341A1/en,https://patentimages.storage.googleapis.com/86/48/e0/61c35607ac1d43/US20130300341A1-20131114-D00000.png
US-4431214-A,Data guide device ,"Federal Paper Board Co., Inc.",Veronica A. Buffington,1980-09-15,1980-09-15,1984-02-14,1984-02-14,https://patents.google.com/patent/US4431214A/en,https://patentimages.storage.googleapis.com/16/53/87/4d53efd3707fae/US4431214-drawings-page-2.png
US-3643106-A,Analog shift register ,Hughes Aircraft Co,"Ted W Berwin, John A Rado",1970-09-14,1970-09-14,1972-02-15,1972-02-15,https://patents.google.com/patent/US3643106A/en,https://patentimages.storage.googleapis.com/1a/d5/9b/6ab29dd0fd3cbe/US3643106-drawings-page-2.png
US-3866171-A,Display verifier ,Reliance Electric Co,Richard C Loshbough,1974-01-18,1974-01-18,1975-02-11,1975-02-11,https://patents.google.com/patent/US3866171A/en,https://patentimages.storage.googleapis.com/a4/b2/58/470ff0f52fe38a/US3866171-drawings-page-2.png
US-7002394-B1,Low supply current RMS-to-DC converter ,"Analog Devices, Inc.",Barrie Gilbert,1999-02-24,2000-10-23,2006-02-21,2006-02-21,https://patents.google.com/patent/US7002394B1/en,
US-3901669-A,Manufacture of hydrogen from high temperature steam ,Sun Ventures Inc,Walter H Seitzer,1973-11-05,1973-11-05,1975-08-26,1975-08-26,https://patents.google.com/patent/US3901669A/en,https://patentimages.storage.googleapis.com/cc/59/13/59d55f319e8a21/US3901669-drawings-page-2.png
US-2581124-A,Alternating-volatge compression network ,Time Inc,Moe William West,1947-07-23,1947-07-23,1952-01-01,1952-01-01,https://patents.google.com/patent/US2581124A/en,https://patentimages.storage.googleapis.com/7b/a2/11/a09eaeb2dcdf91/US2581124-drawings-page-1.png
EP-2498156-B1,Industrial simulation using redirected I/O module configurations ,"Rockwell Automation Technologies, Inc.","Francisco P. Maturana, Raymond J. Staron, Danny L. Carnahan, Kenwood H. Hall",2011-03-07,2012-03-07,2018-11-28,2018-11-28,https://patents.google.com/patent/EP2498156B1/en,https://patentimages.storage.googleapis.com/6e/42/66/1f96ed14128cb3/imgf0001.png
US-2574438-A,Computer using magnetic amplifier ,"Rossi Bruno, Henri S Sack, Robert T Beyer, Glenn H Miller","Rossi Bruno, Henri S Sack, Robert T Beyer, Glenn H Miller",1946-07-03,1946-07-03,1951-11-06,1951-11-06,https://patents.google.com/patent/US2574438A/en,https://patentimages.storage.googleapis.com/7c/bb/a0/a1789030316b20/US2574438-drawings-page-1.png
US-3654916-A,Apparatus for monitoring recurrent waveforms ,Univ Edinburgh,James Mcewan Mcintyre Neilson,1969-03-14,1970-03-16,1972-04-11,1972-04-11,https://patents.google.com/patent/US3654916A/en,https://patentimages.storage.googleapis.com/42/b1/8b/f75fd0441a3ffd/US3654916-drawings-page-2.png
US-4616333-A,Data correlation system ,"Elscint, Ltd.",Yair Shimoni,1984-06-05,1984-06-05,1986-10-07,1986-10-07,https://patents.google.com/patent/US4616333A/en,https://patentimages.storage.googleapis.com/26/7f/4a/795f81f27328b3/US4616333-drawings-page-2.png
US-3567915-A,Method of an apparatus for remotely determining the profile of fluid turbulence ,Trw Inc,"Saul Altshuler, Donald Arnush, Leonard Glatt, Palos Verdes, Arthur Peskoff",1969-07-22,1969-07-22,1971-03-02,1971-03-02,https://patents.google.com/patent/US3567915A/en,https://patentimages.storage.googleapis.com/b6/6f/b5/d8303656d6838f/US3567915-drawings-page-2.png
US-3598976-A,Golf game computing system ,Brunswick Corp,"Jack A Russell, Bradford J Baldwin",1969-09-29,1969-09-29,1971-08-10,1971-08-10,https://patents.google.com/patent/US3598976A/en,https://patentimages.storage.googleapis.com/9f/1e/4f/57426708e22a80/US3598976-drawings-page-2.png
US-2958039-A,Delay line time compressor ,Univ California,Victor C Anderson,1956-05-18,1956-05-18,1960-10-25,1960-10-25,https://patents.google.com/patent/US2958039A/en,https://patentimages.storage.googleapis.com/ab/ea/db/593a67a44ab61e/US2958039-drawings-page-1.png
US-3441789-A,Means and method for generating shadows and shading for an electronically generated display ,Lee Harrison,Lee Harrison,1968-01-12,1968-01-12,1969-04-29,1969-04-29,https://patents.google.com/patent/US3441789A/en,https://patentimages.storage.googleapis.com/7a/a3/60/85096cebd5b983/US3441789-drawings-page-1.png
US-3517175-A,Digital signal comparators ,Plessey Co Ltd,Raymond T F Williams,1966-08-25,1967-08-15,1970-06-23,1970-06-23,https://patents.google.com/patent/US3517175A/en,https://patentimages.storage.googleapis.com/19/89/3b/f5f675d996326e/US3517175-drawings-page-1.png
US-3609316-A,Composite mixture batching ,Pedershaab Maskinfabrik As,"Noel M H Brosset, Johan Winther",1966-05-24,1967-05-23,1971-09-28,1971-09-28,https://patents.google.com/patent/US3609316A/en,https://patentimages.storage.googleapis.com/4a/51/90/a121d9d4a3650c/US3609316-drawings-page-2.png
US-5960576-A,"Range, bullet drop, and angle calculator for use with telescopic gun sights ",Robinson; Bruce N.,Bruce N. Robinson,1998-02-04,1998-09-03,1999-10-05,1999-10-05,https://patents.google.com/patent/US5960576A/en,https://patentimages.storage.googleapis.com/43/88/2a/70862dd761c48e/US5960576-drawings-page-2.png
KR-960001279-B1,Multiplier and the squaring circuit for it ,"세끼모또 타다히로, 닛본덴기 가부시끼가이샤",가쯔지 기무라,1991-03-13,1992-03-13,1996-01-25,1996-01-25,https://patents.google.com/patent/KR960001279B1/en,https://patentimages.storage.googleapis.com/KR960001279B1/kpo00044.png
US-3868497-A,Terminal airways traffic control system ,Carl W Vietor,Carl W Vietor,1971-05-03,1973-08-13,1975-02-25,1975-02-25,https://patents.google.com/patent/US3868497A/en,https://patentimages.storage.googleapis.com/8d/41/33/c6e0cf9f10bf90/US3868497-drawings-page-2.png
US-5608645-A,Method of finding a critical path in a circuit by considering the clock skew ,"Vlsi Technology, Inc.",Athanasius W. Spyrou,1994-03-17,1994-03-17,1997-03-04,1997-03-04,https://patents.google.com/patent/US5608645A/en,https://patentimages.storage.googleapis.com/e9/db/1f/cb1527364b7800/US5608645-drawings-page-2.png
US-3693079-A,Apparatus for measuring percent moisture content of particulate material using microwaves and penetrating radiation ,Charles W E Walker,Charles W E Walker,1970-04-14,1970-04-14,1972-09-19,1972-09-19,https://patents.google.com/patent/US3693079A/en,https://patentimages.storage.googleapis.com/f9/89/88/9dc6dfbca21153/US3693079-drawings-page-2.png
US-4786831-A,Integrating capacitively coupled transimpedance amplifier ,Hughes Aircraft Company,"Arthur L. Morse, Steve D. Gaalema, Ingrid M. Keimel, Mary J. Hewitt",1984-12-17,1984-12-17,1988-11-22,1988-11-22,https://patents.google.com/patent/US4786831A/en,https://patentimages.storage.googleapis.com/d8/bf/57/ab520fb14ff7eb/US4786831-drawings-page-2.png
US-2144337-A,Electrical device ,Rca Corp,Winfield R Koch,1936-02-28,1936-02-28,1939-01-17,1939-01-17,https://patents.google.com/patent/US2144337A/en,https://patentimages.storage.googleapis.com/2a/06/60/2821d410f8fa5e/US2144337-drawings-page-1.png
US-5107150-A,Analog multiplier ,Nec Corporation,Katsuji Kimura,1990-05-31,1991-05-31,1992-04-21,1992-04-21,https://patents.google.com/patent/US5107150A/en,https://patentimages.storage.googleapis.com/18/7d/33/27cd5a6912acac/US5107150-drawings-page-2.png
US-5298811-A,Synchronous logarithmic amplifier ,"Analog Devices, Inc.",Barrie Gilbert,1992-08-03,1992-08-03,1994-03-29,1994-03-29,https://patents.google.com/patent/US5298811A/en,https://patentimages.storage.googleapis.com/47/11/86/a8781bcc2738b5/US5298811-drawings-page-2.png
US-9904515-B2,Multiplication operations in memory ,"Micron Technology, Inc.",Sanjay Tiwari,2014-09-03,2015-08-24,2018-02-27,2018-02-27,https://patents.google.com/patent/US9904515B2/en,https://patentimages.storage.googleapis.com/18/67/85/fcedac06acbc44/US09904515-20180227-D00000.png
US-5379346-A,Cascading synchronized chaotic systems ,The United States Of America As Represented By The Secretary Of The Navy,"Louis M. Pecora, Thomas L. Carroll",1993-09-30,1993-09-30,1995-01-03,1995-01-03,https://patents.google.com/patent/US5379346A/en,https://patentimages.storage.googleapis.com/86/47/be/a209bb7d0f5061/US5379346-drawings-page-3.png
US-3177404-A,Modularized computer construction ,Electronic Associates,James R Patmore,1960-04-12,1960-04-12,1965-04-06,1965-04-06,https://patents.google.com/patent/US3177404A/en,https://patentimages.storage.googleapis.com/f5/03/08/f8aa33427fbb7e/US3177404-drawings-page-1.png
US-2736199-A,ibbott ,,,,,1956-02-28,1956-02-28,https://patents.google.com/patent/US2736199A/en,https://patentimages.storage.googleapis.com/80/79/87/62f955d271c7bb/US2736199-drawings-page-1.png
US-3633086-A,Closed-loop regulating system for a control circuit with a control drive ,Siemens Ag,"Winfried Speth, Rudolf Westermayer",1969-02-12,1970-02-10,1972-01-04,1972-01-04,https://patents.google.com/patent/US3633086A/en,https://patentimages.storage.googleapis.com/81/4b/be/7371a378fb0e3b/US3633086-drawings-page-2.png
US-2406836-A,Electric air position indicator ,Bell Telephone Labor Inc,William H T Holden,1944-03-24,1944-03-24,1946-09-03,1946-09-03,https://patents.google.com/patent/US2406836A/en,https://patentimages.storage.googleapis.com/f5/69/b7/3c93c58f14726c/US2406836-drawings-page-1.png
US-4374335-A,Tuneable I.C. active integrator ,"Precision Monolithics, Inc.","Kiyoshi Fukahori, Yukio Nishikawa",1980-05-19,1980-05-19,1983-02-15,1983-02-15,https://patents.google.com/patent/US4374335A/en,https://patentimages.storage.googleapis.com/95/d5/6c/232ab8d03f4361/US4374335-drawings-page-2.png
US-6795006-B1,Integrator reset mechanism ,Zarlink Semiconductor Ab,"Guy Delight, Remi LeReverend",2003-07-18,2003-07-18,2004-09-21,2004-09-21,https://patents.google.com/patent/US6795006B1/en,https://patentimages.storage.googleapis.com/c6/cb/27/695e629b302792/US06795006-20040921-D00000.png
US-5337243-A,Vehicle orientation calculating device ,"Matsushita Electric Industrial Co., Ltd.","Akihito Shibata, Hiroaki Tsuji",1990-11-13,1991-11-12,1994-08-09,1994-08-09,https://patents.google.com/patent/US5337243A/en,https://patentimages.storage.googleapis.com/e1/36/4f/502519b1dbe995/US5337243-drawings-page-2.png
US-2643819-A,Apparatus for computing correlation functions ,Research Corp,"Lee Yuk Wing, Jerome B Wiesner, Jr Thomas P Cheatham",1949-08-11,1949-08-11,1953-06-30,1953-06-30,https://patents.google.com/patent/US2643819A/en,https://patentimages.storage.googleapis.com/b0/d5/38/fa2743f8761d7d/US2643819-drawings-page-1.png
US-4000643-A,Apparatus for producing a compensating voltage ,Honeywell Inc.,Robert P. Pearson,1976-03-29,1976-03-29,1977-01-04,1977-01-04,https://patents.google.com/patent/US4000643A/en,https://patentimages.storage.googleapis.com/94/dc/2f/db0605fe74acd2/US4000643-drawings-page-2.png
EP-1261309-B1,Device for calculating elixir doses appropriate for a patient's weight ,Brian Kaplan,Brian Kaplan,2000-02-16,2001-02-16,2005-12-14,2005-12-14,https://patents.google.com/patent/EP1261309B1/en,https://patentimages.storage.googleapis.com/30/c9/b4/64171e969e2d58/00150001.png
